<!ELEMENT library (books+)>
    <!ELEMENT books (title, author, price)>
    <!ELEMENT title (#PCDATA)>
    <!ELEMENT author (#PCDATA)>
    <!ELEMENT price (#PCDATA)>